{
  "$schema": "../../schemas/cross_encoder_reranking_manifest_v1.schema.json",
  "batch_size": 16,
  "candidate_depth": 50,
  "candidate_first_relevant_count": 35,
  "candidate_full_evidence_count": 35,
  "candidate_pair_count": 1750,
  "canonical_gold_file": "data/gold/mit_60001/chunks.jsonl",
  "canonical_gold_sha256": "c03abf002c29b784d191eb393670da27b80fed8e0e18798f113d7ff8b7daf432",
  "comparison_file": "reports/11_reranking/cross_encoder_reranking_comparison.csv",
  "comparison_sha256": "6406e8ab364819d6afe474c4b49d61e20db6b5be864381da28cd2b93005d8383",
  "corpus_chunk_count": 861,
  "dense_baseline_metrics_match": true,
  "dense_index_content_sha256": "6e78f39257b7cc5defebd6740aab2dc1a4c202165b073f7a740ee5a5d7c46805",
  "dense_index_manifest_file": "reports/09_embedding/embedding_index_manifest.json",
  "dense_index_manifest_sha256": "4e8d277f630eff2c1a4b8e7721f449400e13f7e2c9fee4d99183270cc6ca388c",
  "dense_model_repository": "sentence-transformers/all-MiniLM-L6-v2",
  "dense_model_revision": "1110a243fdf4706b3f48f1d95db1a4f5529b4d41",
  "dense_top_10_id_match_count": 35,
  "dense_top_10_score_match_count": 35,
  "device": "cpu",
  "evaluation_file": "evaluation/mit_60001/evaluation_questions.jsonl",
  "evaluation_sha256": "81d5a1374118b01d850d7c4808edf89b9432036a4488c49f5150720aa3fc8dee",
  "excluded_out_of_scope_question_count": 5,
  "ground_truth_range_count": 57,
  "max_length": 512,
  "model_cache_policy": "project_local_gitignored_data_models",
  "numpy_version": "2.4.3",
  "output_top_k": 3,
  "pair_token_length_max": 214,
  "python_version": "3.12.10",
  "question_comparison_file": "reports/11_reranking/cross_encoder_reranking_question_comparison.csv",
  "question_comparison_sha256": "e10e418d6188a1802138a7ec976d783bded042ed81d2b8b8cc28a5e5034bfbb8",
  "question_count": 35,
  "ranking_tie_break": "score_desc_then_dense_rank_asc_then_chunk_id_asc",
  "relevance_rule": "same_video_and_source_segment_interval_intersection",
  "reranker_actual_revision": "c5ee24cb16019beea0893ab7796b1df96625c6b8",
  "reranker_model_repository": "cross-encoder/ms-marco-MiniLM-L6-v2",
  "reranker_model_revision": "c5ee24cb16019beea0893ab7796b1df96625c6b8",
  "reranker_model_weights_sha256": "821d1aa69520101d6e0737f78a042ae25b19e5cb9160701909d10434f4aeb0ae",
  "reranker_snapshot_content_sha256": "923d4371d5fe13534d7431895890c2142a8552a441f09ec7b28d035aaae9120c",
  "reranker_snapshot_file_count": 6,
  "reranking_run_id": "mit60001_rerank_46564f781c27d679",
  "reranking_version": "mit60001_cross_encoder_reranking_v1",
  "results_file": "reports/11_reranking/cross_encoder_reranking_results.csv",
  "results_sha256": "0008ff898fe8ecb5dfb8f2f1b0cb1d098dac0dcb35185dfa929b5a07eca10a3c",
  "retrieval_decision_file": "reports/10_retrieval/retrieval_configuration_decision_2026-08-14.csv",
  "retrieval_decision_sha256": "b716b33f2955ebbb2d79e4ebd15bd998c206578a6d764f779af2f6bdaf07b865",
  "schema_version": "cross_encoder_reranking_manifest_v1",
  "scope_version": "mit_60001_fall_2016_v1",
  "score_function": "raw_identity_logit_float32",
  "selected_retrieval_method": "dense_baseline_v1",
  "selection_status": "pending_human_decision",
  "sentence_transformers_version": "5.4.1",
  "torch_version": "2.11.0+cpu",
  "transformers_version": "5.6.2",
  "truncated_pair_count": 0,
  "validation_file": "reports/11_reranking/cross_encoder_reranking_validation.csv",
  "validation_sha256": "f7957d5780755b39cd2db58c03b978f053158a484830a72de647ca3a857c6b35",
  "validation_status": "passed"
}
